{
  "schema_version": "1.0.0",
  "status": "failure",
  "file": "resource-limit.jky",
  "diagnostics": [
    {
      "severity": "error",
      "code": "resource-limit",
      "message": "parser nesting limit exceeded",
      "location": {
        "span": {
          "start": 256,
          "end": 257
        },
        "start": {
          "line": 1,
          "column": 257
        },
        "end": {
          "line": 1,
          "column": 258
        },
        "snippet": "(((((((((((((((((((((((((((((((((((((((((((((((((((((((((((((((((((((((((((((((((((((((((((((((((((((((((((((((((((((((((((((((((((((((((((((((((((((((((((((((((((((((((((((((((((((((((((((((((((((((((((((((((((((((((((((((((((((((((((((((((((((((((((((((((((((",
        "marker_start": 256,
        "marker_width": 1
      },
      "label": "resource limit exceeded"
    }
  ],
  "truncated": {
    "errors": false,
    "warnings": false
  },
  "metadata": null
}
