{
  "schema_version": "1.0.0",
  "status": "invalid",
  "file": "unsupported-target.jky",
  "diagnostics": [
    {
      "severity": "error",
      "code": "unsupported-target",
      "message": "function does not support every declared target: forensic.event.windows_log",
      "location": {
        "span": {
          "start": 131,
          "end": 157
        },
        "start": {
          "line": 5,
          "column": 12
        },
        "end": {
          "line": 5,
          "column": 38
        },
        "snippet": "    return forensic.event.windows_log(target, \"System\", since, until, 10)",
        "marker_start": 11,
        "marker_width": 26
      },
      "label": "target support mismatch"
    }
  ],
  "truncated": {
    "errors": false,
    "warnings": false
  },
  "metadata": null
}
