{
  "schema_version": "1.0.0",
  "status": "invalid",
  "file": "missing-delimiter.jky",
  "diagnostics": [
    {
      "severity": "error",
      "code": "missing-delimiter",
      "message": "missing delimiter",
      "location": {
        "span": {
          "start": 58,
          "end": 59
        },
        "start": {
          "line": 3,
          "column": 24
        },
        "end": {
          "line": 3,
          "column": 25
        },
        "snippet": "fn inspect() -> report {",
        "marker_start": 23,
        "marker_width": 1
      },
      "label": "missing closing }"
    }
  ],
  "truncated": {
    "errors": false,
    "warnings": false
  },
  "metadata": null
}
