{
  "schema_version": "1.0.0",
  "status": "invalid",
  "file": "missing-run.jky",
  "diagnostics": [
    {
      "severity": "error",
      "code": "missing-run",
      "message": "program requires one top-level run statement",
      "location": {
        "span": {
          "start": 128,
          "end": 128
        },
        "start": {
          "line": 6,
          "column": 1
        },
        "end": {
          "line": 6,
          "column": 1
        },
        "snippet": "",
        "marker_start": 0,
        "marker_width": 1
      },
      "label": "run statement required"
    }
  ],
  "truncated": {
    "errors": false,
    "warnings": false
  },
  "metadata": null
}
