{
  "schema_version": "1.0.0",
  "status": "invalid",
  "file": "missing-return.jky",
  "diagnostics": [
    {
      "severity": "error",
      "code": "missing-return",
      "message": "function may finish without returning int",
      "location": {
        "span": {
          "start": 88,
          "end": 89
        },
        "start": {
          "line": 3,
          "column": 53
        },
        "end": {
          "line": 3,
          "column": 54
        },
        "snippet": "fn helper(flag: bool) -> int { if flag { return 1 } }",
        "marker_start": 52,
        "marker_width": 1
      },
      "label": "return value required"
    }
  ],
  "truncated": {
    "errors": false,
    "warnings": false
  },
  "metadata": null
}
