{
  "schema_version": "1.0.0",
  "status": "invalid",
  "file": "argument-count-mismatch.jky",
  "diagnostics": [
    {
      "severity": "error",
      "code": "argument-count-mismatch",
      "message": "wrong argument count: expected 1, found 0",
      "location": {
        "span": {
          "start": 87,
          "end": 110
        },
        "start": {
          "line": 4,
          "column": 5
        },
        "end": {
          "line": 4,
          "column": 28
        },
        "snippet": "    forensic.system.profile()",
        "marker_start": 4,
        "marker_width": 23
      },
      "label": "argument count mismatch"
    }
  ],
  "truncated": {
    "errors": false,
    "warnings": false
  },
  "metadata": null
}
